{
  "contract": "ados.capture/1",
  "kind": "splat",
  "file": "splat.spz",
  "format": "spz",
  "sha256": "9f86d081884c7d659a2feaa0c55ad015a3bf4f1b2b0b822cd15d6c15b0f00a08",
  "anchor": null,
  "R_enu_artifact": [1.0, 0.0, 0.0, 0.0, 0.0, -1.0, 0.0, 1.0, 0.0],
  "t_enu_artifact": [0.0, 0.0, 0.0],
  "scale": 1.0,
  "generation": 2,
  "source_session": "visor-1-20261019T101500Z-3fa2"
}
